{
  "aiwip-version": "0.1",
  "name": "Workflation",
  "description": "We help modern teams scale productivity using AI-powered workflow design, automation, and optimisation tools.",
  "location": "Silicon Valley, California",
  "services": [
    "AI workflow design consulting",
    "Digital productivity audits",
    "No-code and RPA-based automation builds",
    "AI policy advisory for businesses",
    "Custom GPT integration services"
  ],
  "website": "https://workflation.com",
  "contact-email": "info@workflation.com",
  "socials": {
    "linkedin": "https://linkedin.com/company/workflation",
    "github": "https://github.com/workflation"
  }
}
